{"schemaVersion":1,"repository":{"root":".","identity":"example-repository","scope":"repository"},"source":{"revision":"1111111111111111111111111111111111111111","dirty":false,"statusSummary":[]},"commandments":{"path":"COMMANDMENTS.md","sha256":"aaaaaaaaaaaaaaaaaaaaaaaaaaaaaaaaaaaaaaaaaaaaaaaaaaaaaaaaaaaaaaaa","version":1,"ratifiedAt":"2026-08-28T12:00:00Z"},"currentState":"initialized","resourceIsolation":"isolated-shell","transitions":[],"artifacts":[],"verification":[],"firstStep":{"selectionPath":".pi/jig/steps/0001/selection.json","selectedCandidateId":null,"proposalPath":null,"resultPath":".pi/jig/steps/0001/result.json","outcome":"no-eligible-candidate"},"evaluation":{"required":true,"status":"passed","verdictPath":".pi/jig/evaluation/verdict.json"},"tools":{"jig":"1.0.0","pi":"0.58.0","python":"3.12.3"},"createdAt":"2026-08-28T12:00:00Z","updatedAt":"2026-08-28T12:30:00Z"}
